{
    "schemaVersion": "0.10",
    "description": "Testing Profile",
    "fields": [
        {
          "name": "foo",
          "type": "string",
          "nullable": false
        }
    ],
    "rules": [
        {
            "rule": "rule1",
            "constraints": [
                {
                    "field": "foo",
                    "is": "equalTo",
                    "value": "Generation successful"
                }
            ]
        }
    ]
}